{
  "$schema": "https://json-schema.org/draft/2020-12/schema",
  "$id": "eng/ship_note.schema.json",
  "title": "EngShipNote",
  "type": "object",
  "required": ["summary", "verify_commands_run"],
  "properties": {
    "summary": { "type": "string" },
    "verify_commands_run": { "type": "array", "items": { "type": "string" } },
    "follow_ups": { "type": "array", "items": { "type": "string" } },
    "risks": { "type": "array", "items": { "type": "string" } }
  },
  "additionalProperties": true
}
